id,content620,many people wear cloth facial masks at night. possible applications include imitation sunrise(brightening) inside of a noisy alarm. also possibly movies etc623,Create novelty kites which change colors.624,"Directional carpets - Carpet with directional arrows pointing customers to different locations, such as, banks, supermarkets, etc."625,Use as a teaching aid for kids i.e. math627,"gifting would be more personalized and more creative with this. people could make something really special, and easily print images on the item, and give it as a gift that was personalized just for them."628,"Allow shirts to broadcast information from ""phone"" on them such as time weather date. You could also make this into some sort of band."632,pop up tents displays. Used for tent kiosks to display marketing info.633,sports teams gear635,Blimp advertising with fabric display panels.636,this would work well with dolls clothing and other toys that have cloth on them. parents could make interesting clothing for their childrens dolls and action figures.639,Bed sheets that can identify and signal whether they are clean or dirty.640,holograms642,"this might be good for advertising as well, since videos could be displayed on it."644,"set up a cylindrical frame clad in a transparent cloth, have movement trackers so that images projected move with people. basically mimicking a hologram. I suppose track could be made unnecessary with geometrically shaped cloth on a fine scale"646,"t-shirts with built in fabric display. It can be used at kids parties for fun.
use it to display ads on street. Hire people who can wear it.. 
hats with display on the front. You can easily take it off and watch your favorite video
fabric wristband with display attached to it. It'll look similar to a watch. You can wear it anytime and it'll be cheap because it's made out of fabric.
towel.You can use it to display videos while taking shower or brushing your teeth.
car seat cover. People in the back seat can watch movies 
carpet. You can change the display image and you have new carpet whenever you want"647,"if videos could be displayed on it, it would be easier to have a small peive of cloth that you could just shove in your pocket and not have to worry about breaking."648,t-shirts with built in fabric display.649,It can be used at kids parties for fun. use it to display ads on street.650,hats with display on the front.652,fabric wristband with display attached to it. It'll look similar to a watch.654,towel.You can use it to display videos while taking shower or brushing your teeth.656,car seat cover. People in the back seat can watch movies658,carpet. You can change the display image and you have new carpet whenever you want665,fabric glasses. You can wear it anytime and enjoy your movies or soothing images.669,team clothing. they could easily display team colors/video/scores on uniforms for sports teams.672,"music videos on clothing for music lovers like me! it would be like youtube, always playing videos on your clothing."676,Make presentations anywhere by carrying a folded sheet around677,"Watch movies in your backyard, hanging a screen from a clothesline"682,watch movies on the back of an airplane seat683,chef coats could display food images of the menu they offer. same for the waiters at a restaurant.686,project drive-in movies without expensive projection equipment689,dog collars could have their name/number scrolling on it in case they get lost.693,"Instead of a mobile above a child's crib, project soothing images on the ceiling."695,Project images as a decoy during military missions.696,carpet or fabric that can sense when it needs cleaning and alerts the owner.698,shoes that can gauge distance/mileage and tell you how fast you are walking or running and also act as a gps.699,"It could be used as a cheaper means of television screens, computer monitors and the like."700,"Project images on the floor of a building, to direct people to the exits in case of emergency, or just point them to different locations."701,It could be used to make underwater screens where normal electronics that display images and videos cannot.702,There are many possible military applications. One is certainly to make soldiers' clothes camouflage.703,It can be given as a gift to someone with special pictures704,cover a wall with the fabric and stream your favorite shows on it instead of having a tv.705,"Cover the walls of your house with fabric, change the color of the room anytime you want."706,Make any wall into a television.707,It can be a tool to show your emotions depending on the color that is displayed.708,It could be used for cheap and makeshift education materials in poor countries and communities. Educational and instructional video could be displayed to a large amount of people without needing equipment.709,cover the walls of a baby room with fabric that displays calming ocean views/fish and has relaxing sounds for the baby.710,Great for a more comfortable movie experience!711,Change billboards at any time without having to climb up and replace the picture.712,"It could usher in a new age of digital interior decoration: consumers could decide the patterns for their drapes, sofas etc. on the fly and change them at any time without needing to invest in new materials."715,This can be used as a fun family portrait. So that all family members can share their memories; it can be place in the living room.718,"It could introduce many new possibilities for art, since images and video that are usually static and flat could be twisted, folded and shaped."721,Create large-scale interactive video games (think laser-tag style) with images projected on every wall and surface.722,stores could hang large fabric pieces over aisles to display what is in the aisles and what's currently on sale.723,"It could be used for a cheap means of advertising. Suddenly everyone could have access to their own billboards, signs, etc. that could be updated at any time digitally."725,"blankets could display news, videos, tv or calming scenes to help you relax."726,It would allow for impromptu displays to others. You could be carrying your handkerchief around and need to show someone something on video and it would provide the means.727,"blanket or pillow that can interact on a website so you can shop, such as amazon.com"728,"It could usher in a new age of fashion, where people wear blank clothes that are simply a canvas, and the design is chosen and updated digitally and can be changed at will."729,Use as a classroom smartboard without the need to take up space or move equipment around from room to room.730,Can be used as advertisement for certain brands.731,Can be used as identification at work or at certain events.732,Can be used to change the design of a shirt over a period of time.733,"Products that contain fabric could advertise to customers in stores in real time. For example, I could walk down the bedding aisle and see different commercials displaying on the products."734,As a replacement for projectors and projector screens.735,"This fabric could be used as a school uniform, and can change colors as instructed by teachers."736,Can be used to show videos about a vacation to a relative.737,"Large pieces of fabric could be used to hide unsightly buildings, graffiti or other eyesores where cleaning them up is otherwise too expensive and not feasible. They could simply be covered with the fabric and then it could be made to blend in with the surroundings."738,Can be used to gather support for a protest.739,"I think this fabric can be wearable and if people hug you, it will gradually change colors and everyone will know how loved you are!!"742,You can change its colors depending on your relationship status.743,Tablecloths in restaurants could be used to provide real time interactivity or entertainment to all customers.746,It will remind you about daily activities.749,Digital art museums using pieces of fabric that are updated manually could become a new thing.750,Can be used to create a pillow that doubles as a movie viewer.752,Can be used as a shower curtain that can show movies.757,Can be used as a billboard.758,Use it to show videos in classrooms more easily759,Use it to promote different brands760,Use it to promote movies761,Use it to quickly change looks without having to change clothes762,Use it to create moving art for your home763,Use it on bedding to quickly change the look of your bedroom764,Can be used as a kite to display a message or advertisement.765,use it on any fabric around the home to make it interactive and changeable quickly766,Can be used as a part of a phone.767,"Cover an entire wall in it to make it look like the wall isn't there, and you're instead looking at the outside"768,"cover a couch in fabric that looks like water, when you come in contact with it it causes ripples"769,"create a shirt with a small flame on the front, when you hug someone it puts the flame out and causes smoke."770,use it in concert with a video of the scenery your standing in front of to make yourself invisible (from a particular angle) even when moving.771,Cover your mousepad with it to make it interactive. (again I like the rippling water idea.)772,create scarves that show various effects. Snow/fire/rain/clouds etc773,cover your ceiling in panels of it to make it look like a moving sky774,Cover a tent in animated (as if by wind) brush to create the perfect camo775,"A prank. Put it behind what looks like a mirror frame. When unsuspecting people look in to it they see someone other than themselves, animated."776,Use it as a rug. Make it look like a grate with an animated crocodile/other animal underneath.777,"Use it on the floor to make a far more realistic version of ""the floor is lava"" game"780,Cover books with it and create an animation that advertises or enhances the story782,use it on lamp shades to add a moving scene785,"You could use it to make signs around the house to remind kids of things to do (chores, schedule, etc)."786,It would be good for displaying recipes while at the stove cooking.787,It would be useful for sharing video with places around the house there normally aren't TVs and that you wouldn't want to have an electronic device (bathtub/bathroom).788,"It would be really cool to use to display photographs or videos for a birthday, anniversary, engagement, graduation, etc. party."789,Wearable tablet computers would be a useful application.790,It could be used to make clothes that can change based on what colors you feel like wearing or camouflage.791,It could be used to make portable interactive games.792,It could be used as a carpet or area rug that interacts with people when they walk on it.793,It could be used to make curtains that change color or shade based on the amount of sunlight coming in.794,"It would be useful for athletic activities - easily change the color of a shirt for setting up who's on what team rather than having to wear a separate pinny over, for example."795,"It would be useful in a hospital setting - for instance, patient blankets that change colors based on certain statuses (NPO, diabetic, allergic to a certain type of medication) so that nurses and doctors who entered a patient's room would know an immediately important fact about the patient without having to read a chart."796,"Restaurants could have color-changing napkins that would alert the staff when a table is ready to order or when they're finished so they know, without being flagged down, that a particular table needs their attention."797,"Bicyclists could use color-changing clothing that would adapt to the level of outdoor light and their surroundings, making them more or less visible as necessary to help prevent accidents."798,A t-shirt that can advertise different products or things.799,It could be used to make a newspaper that would fold up and easily fit in a purse.800,Interactive political yard signs or t-shirts - someone could touch the sign in order to get more information about the candidate.801,Cover a room's ceiling or a wall with the fabric in order to have a giant display or simply something that changes color with mood.802,A flag that changes between various nations.803,"It would be great for making a canvas for artists that can then change based on how the artist programs it - different things appear at a different time of day, for example."804,"It would be useful for making an interactive beach towel - the towel could let the person using it read a book, watch something, or play a small interactive game without having to have another item or device with them."805,Interactive bulletin boards in school classrooms and hallways would be another potential use - allow parents to browse through a whole assortment of work their child has done at a simple touch.806,Large advertising billboards that change based on time of day or day of the week in order to target different audiences.961,Used as a type of green screen for visual effects979,"tie die shirt, senses touch, leave handprints on your shirt for a cool design just by touching it."983,made into various articles of clothing to see how potential buys would look before actually purchasing them1004,A mobile advertising board. People could be paid to put large ads on their clothing.1012,Display peoples names on seats.  When someone is at a movie or a game they can see where their seat is.1024,stadiums can use them as changeable banners when different teams play1026,Hang on the wall to have an ever changing picture that constantly changes over time.1027,Electronic reader boards on peoples clothing.1028,Wearable advertising1035,There could be an option to display certain patterns or colors in order to be more easily spotted by someone you're supposed to meet up with.1037,A fabric underwear that tell your body temp.1038,Cover a couch in them and you can have a different colored couch every day.1049,A color changing swimming suit based on how warm the water is.1053,Made into an arm band or head band that broadcasts your favorite sports teams colors to show team spirit1055,Clothing that can change color without re dying1057,crafts for children1058,"downloadable shirts ""art"" which you can pay a small fee for as fashions change"1061,write signs on shirts1062,A mood shirt that lets you know your teachers feelings.1063,Display ads in empty seats at sporting events.1064,demonstrations1066,work projekcts1067,advertising on sports jerseys1070,change color of clothing1072,Use the fabric as a clothing.1074,business proposals1077,games1081,Advertise on people's wardrobe.1082,Display team logos in seats at sporting events.1083,keep reminders1087,Wear your big work presentation on your work clothes so you don't forget it. or have to carry it.1090,Make tangible books out of the material.1091,Portable video screens for offices1092,tell time1093,A trampoline that shows your imprint when you land.1098,could be used to replace the blackboard and even classroom (like for trips) to aid a teacher1101,tide chart for surfing1103,a scholastic book that a child could fold up and put in their pocket1106,Change the color of your clothes if you're out with friends and a buddy has the same exact shirt on.1107,Replace stiff monitors.1108,A dog shirt that shows when a dog is losing weight.1110,The fabric display can be part of emergency kits and includes various emergency messages1111,Use on t-shirts  and other clothing for images.1112,"Use for a game, like twister, so you don't have to actually have the game with you and can play where ever you go."1114,change clothes color with mood1118,Military camouflage that adapts to the enviroment1122,a mobile video platform that would take virtually no space to carry1126,A rug shaped like a piano that plays in tune with the steps taken on it.1127,Make clothing that can display moving images.1129,Table cloths that display the menu1130,let others know your relationship status at bar1131,"Hang on the wall and display family pictures through a constant flow, like an album."1133,Use them as teaching props: art studies and math boards.1134,A blanket for toddlers that alarms parents with they wet bed.1136,"Create an entire wardrobe form a single suit.  Make a suit out of the fabric, and set the display to different colors/textures.  Even use skin colored texture to create short sleeve/short-pants looks."1143,Personalized billboards from companies that reflect changes in weather.1144,"Use as a carpet to teach dance steps, such as the waltz, or tango."1148,this maybe a lucrative product for internet or cable service provides if it could handle the capacity1150,Use as a stealth device for soldiers to get behind enemy lines.1151,Foldable cell phones.1154,identify name of song that is playing1155,A display on a purse or sleeve showing the time and any other useful info1159,"Put indicators of mood on clothing. If you don't want to be bothered, put something that indicates that."1160,A towel that contours to body.1163,"Hang on the side of a house, use as a projector-like entertainment piece."1164,Color changing wall paper1165,see if patterns or colors coordinate1166,Help advertise your new movie by wearing the trailer on your clothes.1167,give notification updates1168,MAKE A TSHIRT THAT CAN CHANGE TO VARIOUS PICTURES WITH JUST A TOUCH1169,A t-shirt with a gif of a soccer player making a goal.1174,Make them into blankets for night-time light.1175,You can use the fabric display technique during white out conditions1178,A leather jacket that activates heaters when cold.1179,Have an entire room in the house be a movie projector.1180,Car interiors that can change color1183,use as a teaching tool for preschoolers and toddlers1186,comforter for a bed that you can change whenever you like1189,"Dress your children in them, let them keep each other occupied with cartoons playing on them."1191,"Use as a learning device in school, such as a large tablet that fills the blackboard and students can come up to the front of the room and touch the tablet during lessons."1192,"display information from your smart phone on your sleeve.  Show who's calling, the time, number of emails etc."1195,Integrate it somehow with 3D printing technology.1196,Wallpaper that could change how it looks based on your mood/weather/etc.1201,Make them into scuba gear; it'll light up the darkness beneath the water.1203,comforter for a bed that you can watch videos on1206,create flashlight effect for walkers1209,A neck scarf that cools when sweat is detected.1211,because of it's small size could help small firms and companies in communicating; especially if colleagues are far from eachother1213,Create interactive place mats when eating. Could change to fit the food if you're having guests over to have a party or having a one on one romantic evening with someone.1214,"Be able to use your computer on the go, on any surface with a piece of cloth."1215,use fabric for billboards instead of electronic boards1216,dish towel that doubles as a video player for recipes1217,"Using the fabric on jackets, to help with cold temperature. Maybe a better insulation."1220,a washcloth that changes colors as it degrades. This could tell you when to replace it.1221,safety for hunters1222,"Make it into a ""smart"" wristband."1225,MAKE JEANS THAT CAN TURN TO DIFFERENT DESIGNS1229,little league or any team uniforms can be used with this technology. The designer can create the image and have it display on the clothing instead of heat sealing it on.1230,Can use as a towel that measures how much water you've used1233,Have comparisons to other fabrics listed on the side so people can get an idea of what they're in for1235,Safety warnings from public institutions i.e. different colored flags on the highway that reflect Amber Alerts or how safe the roads are (a color coated system will be in place).1236,"obviously has use in the military, navy or airforce"1238,a bath towel that you can watch the news on in the morning after your shower1239,Invisibility cloak1241,"A napkin that automatically moves when it touches drop of water, thus cleaning stuff itself."1242,"Using it on camping gears, like tents. Allow it to be sturdy against weather and temperatures."1243,MAKE HEADBANDS THAT EXPRESS HOW YOU FEEL FOR THAT DAY OR TIME1245,A tool to decorate walls inside a house. Patterns to trace on to be painted later. This would act as a guide to what the wall would look like before painting.1246,Fold able interactive maps. connect a small GPS unit and the map can tell you were you are going1247,"Turn people into ""walking advertisements."""1248,"Have walking billboards.  Have commercials, and advertising graphics display on people as the go through their day.  Use anything from  celebrity endorsements to local community sports teams."1249,"to use as a useful and decorative ""white"" board"1250,Use it to put logos of corporate sponsors on athletes uniforms.  The display can change and sponsors can buy time much like they do for commercials on TV.1251,Make it into a trampoline - foot touch.1252,Can use as a shirt that measures your heart beat and sends you suggestions on how to calm down or pick up depending on what you need.1253,Use for small children to play video games on a smooth surface that won't hurt them.1255,Make holograms with it on fabrics.1256,"Turn into vests for construction workers, security guards, etc. at night to they're more visible."1258,use with virtual reality to create lifelike environments1259,Put the waterproof fabric at the bottom of a pool and have it change colors if someone urinates.1261,Cover a wall or floor in it to have an interactive design.  Make a molten lava floor for kids to play on.1262,Display phone notifications on clothing.1264,light up children at night so parents can see them1265,man I dont know1267,Have peer reviews and ratings for accuracy of the displayed fabric1268,use for walking billboards1270,Create a very unique and original mousepad.1271,For use as a gimmick in magic tricks; i.e. vanishes and appearances.1272,Interactive chess board on a shirt.1274,PUT COMPANY INFOMMERCIAL ON BACK OF TSHIRTS1275,A t-shirt with changing photos.1276,Can be used to camouflaged small items1277,Cover the walls with it like wall paper and you can change the walls color1278,Color changing table cloth for decoration on holidays. Different themes could be changed.1279,Make your own invisible cloak.1280,Use for people to design their own t-shirts.  People could create a design on a computer and then upload the image to the shirt.1281,let you know your blood alcohol level before you drive1283,A message board for people to connect to one another on this technology and discuss it.1287,say goodbye to the conventional television set...1288,A banner that plays music when the wind moves it.1291,"Use as a place mat, kids can play with it and read their menu choices, etc. It will keep them occupied and entertained while adults talk."1292,STORES CAN USE AS AWNING TO DISPLAY THEIR VARIOUS PRODUCTS1293,Interactive clothing displays that shows you information on the display as you touch it.1295,Can be used as a hat that can change logos every so often to maintain relativity with any outfit1296,Using the material on cars. Maybe on the car seats.1297,use for a light show at an event1298,Add pretty cool lights to your clothes1299,An electronic shirt that connects to a computer via USB. You could then download images and designs to display on the shirt when you go out wearing it.1301,Something to identify your child if he/she is lost or kidnapped. Like an alarm that goes off if the child goes off of an expected route to school or something. The clothing starts lighting up and grabs the attention of others.1302,change your favorite sports team or jersey1303,Airbags on car. Maybe the material can be better than the current one they have right now.1304,"With the projector connected to the internet and the fabric hung on the ceiling, it could be an interactive and live astronomy chart. Following the night skies and constellations. Educational or just for fun."1306,Make it into a washcloth that would determine skin infections and other abnormalities.1307,use to create custom changing logos on clothes1309,A shirt that imprints punch marks for training in martial arts.1310,a shirt that has a couple different patterns you can choose from to coordinate with your other clothes.1311,"Can be used as socks that change appearance, could be athletic of not depending on how you want to look"1313,A kids' backpack with changeable images and colors.1314,Make clothing for dogs.1315,Ties that can change styles with the touch of a button.1316,Interactive map at a mall hang it up and touch were you want to go1317,use to put your name on clothing1318,Use for warnings and public announcements during states of emergencies like natural disasters or terror attacks.  Enable the fabric to receive information from government agencies to direct people to safer areas.1320,night time surfing1321,A portable movie/tv screen. This would have less glare and setting it up on a wall would be easier than moving a whole projector/screen combo.1322,Make them into flags that represent different colors.1323,Use it on t-shirts to instantly change your style anywhere.1324,Turn your entire wall into a television. We will no longer be restricted by the room available to us.1325,An umbrella that opens as soon as water hits it.1326,"In places where projectors are used, this can take the place of a large projector."1327,Use it on pillows and bedding in hospitals to sense heat and change color when patients need to be shifted or the sheets need to be changed.