id,content139,project your favorite logo on your clothes142,wear your favorite pattern and change the patterns with your outfit for the day143,Schools can use it to have a large scale movie day144,project your ideas that youre thinking on your clothes.  i.e. your blog145,replacing old movie theaters with outdoor ones.146,project family pictures on a blanket147,A flag that can display different country's flags148,Create a portable projector that can be attached to curtains in any room.149,You can have videos of cars driving at car lots so customers can see the car in motion.150,put pictures of family members on childrens blankets so they wont miss them so much151,a large banner used for advertisments152,project video games being played at birthday parties.153,changing target practice154,t-shirts that change colors and styles155,Project video games at a tournament.156,Make an App that you can customize designs that will change the display connected to your tshirt so you can make custom tshirts whenever you want.157,hide a seek on a blanket158,pants that change colors and styles159,Being able to show family videos at reunions.160,Sell to travelling salesman for pitches on the road for their presentations.161,board games and wack'a'mole on pillows162,hats that change colors and styles163,use it at display stands in cosmetic areas for advertising164,blinds that change with the weather outside165,Provide to underfunded schools to replace their expensive projectors in classrooms.166,A shirt which changes color in response to touch/wind sensations167,"At weddings, have videos of their meeting and photos of the couple playing at the reception."168,Give to medical missionaries to give presentations to local populations about illnesses.169,"blinds that can change depending on what event is happening in the house.  i.e. birthday, funeral, etc."170,use it to provide directions for people who are lost by touching the screen171,"I would use this for large billboard types of advertising on buildings vs hard-wired hard surfaced types.  They fabric can be stretched and securely attached to buildings, etc. and easily disassembled.   It can have some movement as well which would enhance the advertising and catch the eye."172,tent material that blends into different environments173,fun interactive throw pillows174,"record video of self reading a book. Hang in a crib for small child to show when gone, deployed."175,"At prom, having videos shown of the past year that the students submitted being shown all night long."176,Use in stores for unique display signage.177,use it to on billboards for advertising180,Schools can use it as a projector for classes.181,hunting gear that changes its camo pattern to different environments182,"Attach to a canvas to make ""custom art"" that owners can change when the feel like it."184,Attach to a TV input so people can use it in place of a TV on a space like a projector screen or curtains.185,A tablecloth which would be lit up at each person's station when they set down their plate.186,use the handkerchief size to show small videos during business presentations187,It can be used to advertise local places on the sidewalk even in teh rain.188,Market it as a home decor trend and create patterns that can be displayed on curtains and other linens for a custom and changeable look.189,"Have older relative, maybe mom or grandmother, do cooking video to display. in kitchen like a photo."192,reusable textbook cover that changes its label depending on what book its on193,Use in the military for covert missions where people must blend in with their surroundings.195,use it as a message sender by giving the handkerchief to different people196,Put in public spaces so people can interact with displays for advertising purposes.197,"During a funeral, draping the casket with the fabric and having photos being played of the person while they are being escorted to the gravesite."199,light up bedding that helps children who are afraid of the dark200,fabric billboards with advertisements201,frame the fabric as a picture so it can display multiple pictures or different pieces of art202,fabric newspapers203,Put them in bus stops and train stations to serve as notification services for when the next train is coming.204,"Use for jogging at night for safety (t-shirt size).   It would give visibility to me so I would not be hit by a car, another jogger or pedestrian."205,fabric magazines206,use it for sports events by giving small cloths to fans at the games to display team colors208,an indoor mural that can change209,display master of animal on some sort of toy to keep pet interested while home alone. It will help keep interested if when touched the toy talks to pet.210,Make games that can be bought on your smartphone and can be played whenever the device is attached to a cloth surface.211,"Show to kids at daycares and play movies or cartoons on it. Let it be interactive as well so if they touch it, they can create something."215,"A changeable room environment. Large panels of fabric hung like wallpaper on the walls of a room could create an entire environment to resemble a bamboo forest, for example, or an alpine lakeshore. The fabric could display moving wildlife such as pandas in the bamboo forest or birds on the shore of the mountain lake. The possibilities are endless!"216,Reusable newspapers.  have the app update with the most current news and sell a single newspaper that will be updated whenever users refresh their feed.217,camo blanket that can change patterns to be used by soldiers219,use it for awareness at charity events by giving people the fabric to show their support for a cause which also displays some images about their charity220,"fun bath towels which light up when being used, and then (since they are waterproof) go back to their original color as they dry"221,"Create a hard bound book with cloth pages that will serve as an ereader.  That way, people can still have the experience of reading a physical book, but it can be any book they want."222,to be used as a backdrop for animals in a zoo exhibit223,pocket squares225,Billboards equipped with this would be inexpensive to change advertisement or display some sort of message.226,Keep in the pocket of pants when trying to surprise someone with an engagement video or something like that.228,"Use in a room to simulate the weather outside (clouds and stars on ceilings, etc.)"231,red carpet for events that can change colors232,"At Halloween, project scary images in the house."233,Wearable advertising.  Give free clothes to people who then generate advertising revenue in return.235,"Use as a quick ""set change"" for plays or theater arts."237,Make soft interactive baby toys that are safe for use even when parents aren't around.238,material can be used on shoes that allow the user to customize240,Create a kind of interactive card like a buss pass that could give you updates when touched.241,use it as warning signs for  various locations and display what could happen in the dangerous situation242,Wearable moodwear.  Your clothes will change to fit the color/pattern which matches your mood and disposition.  People can immediately judge how they react to you and what you say.243,Make bright vests that always glow for workers that work outside at night.244,car seats that change patter or colors245,Sell to hunters as a glowing safety jacket.246,table cloth that changes colors or pattern247,"Use for camouflage:   diving - to blend in with ocean marine life.  Make to look like water so certain species cannot see me (sharks, etc.).  Use for military Navy Diving Seals to camouflage them.   Use in military soldier uniforms to disguise them according to location type (desert, jungle, buildings, etc.)."248,upholstery material that changes color or patterns249,Make a jacket for paramedics and emergency responders that allows them to access information on the go.250,"Have it playing aquarium scenes and if you touch the screen, the fish swim fast away."251,use them on a float for a parade to show whatever theme you are trying to represent during the event252,Living wallpaper.  Decorate your living- or workspace with cloth panels that show live or simulated scenes from other places/desired images.253,Make Tee shirts with an interactive game to amuse small children.254,phone and tablet cover material that changes color or pattern255,Make seat back displays that children can play games on while in the car.256,Sell to food trucks and other vendors as a portable marketing tool for their advertising.257,billboard about home owners insurance that only shows up during strong winds--with a message about insurance for wind damage260,car cover that displays a picture of the car underneath261,use it to teach young children learning lessons during preschool by loading teaching images on the fabric that they can touch as they learn262,Use for wearable art and fashion statements.   Fashion - colors could be easily blended and displayed on models.263,clothing for people who enjoy going to raves264,Wearable sandwich board for advertising. Video content and messages could be tailored to the demographics of the area of the city where workers are sent to spread messages about sales and other retail offerings.265,"Informative sports wear.  Displays shows your current fitness level and activity.  Calories burned, distance travelled, time left to exercise can all be seen readily"266,Make a baby blanket that when touched displays the voice and image of a parent to comfort a child.269,Use in art classes in schools where buying art supplies is expensive.  Allow students to use an app that simulates painting and drawing on canvas.271,Craft stores can show crafts in store on the screen that is hanging up near different craft things.272,holders for different foods that display the food on the outside274,multiple games in one275,The ultimate Halloween costume.  Basic coverall displays the viewer's worst fears.276,put it on a wall as a poster that can change the picture intermittently277,Meetings can use them as individual projectors and set them in front of each person.278,picnic blanket that changes depending on where you are279,put a picture of your spouse on it and was yourself with it280,Make clothing completely out of fabric where it can be changed to any color or print to fit any occasion.281,socks that change color or pattern283,Replace control devices on motorized wheelchairs with a sensitive touchpad/armrest for those with mobility issues.285,"Put it on a shirt and have ""image changing"" clothing."286,fabric clock to hang on the wall288,Wall sized paint chips. The fabric could project exact shades of color from the paint selection offered by a manufacturer so consumers could see how the choices look on site with the actual lighting of the room.289,Make apparel for athletes that monitors your body and provides information to an interactive app.290,portable fabric TV that you can take anywhere291,use it for people with speaking disabilities who cannot otherwise communicate easily.  They can load simple images or identifying information on a handkerchief.  Like Alzheimer's patients who get lost292,Make hospital linens that can monitor patients vital statistics. Make them so they can change color should something be wrong.294,put a picture of the family on it and use it for your baby to make the baby feel safe295,Rave-wear.  Clothing that when worn at music events like raves or concerts changes colors and patterns in time with the music.296,fabric computer monitor298,Party favors.300,put weird pictures on it to make a great costume for Halloween301,Create napkins in restaurants that can display desert menus while eating dinner.302,fabric monitor for doctors in the field303,fabric xray display305,"using the touch feature, have it change pictures depending on where you touch it"306,bed sheets (sold in adult stores) which display an array of colors during love making307,"Use for a tent - sides and canopy can show different designs, colors, etc.   Large event tents to advertise company logo, scenes, etc.   Wedding tents for something different and can show pictures of bride and groom when younger and dating memories leading up to wedding.   A kaleidoscope on the tent, or billboard(s)  for rock concerts, special events (grand openings), etc."308,you can have different colored shirts or pants very easily without needing to buy duplicates309,book310,"A dog collar that displays the dogs information (address, phone number, etc.) and glows in the dark."311,Re-usable newspapers.  The newspaper receives the display from the news organization.  Only one newspaper ever needed to purchase.  Cut down on printing costs but preserve the feel of newspaper for those who like that.312,Wearable countdown clock for transit workers. The fabric could be used with wi-fi transmission of the subway arrival times to enhance the visibility of arrival information in subway stations. If passengers were unable to see a countdown clock from where they were standing on the platform they would be able to look for a transit worker whose clothing would display the same information.313,A childrens backpack that can be changed with what they want on it.316,put it on a pillow so you can sleep on your favorite picture317,umbrellas that change colors when rain drops hit them319,"make a ""welcome mat"" with your favorite picture or video"322,Car seat multimedia centers.  Car fabric can be used to generate gaming/tv screens for passengers to watch.323,Replace current projector screens.325,"use it as a rug where everytime you step on it, the picture changes"326,Personalized dog bed. The fabric could display images of the dog taken at various times so the dog would al;ways be there even if not in the bed.328,Create a water game that has animals displayed on the fabric underwater.330,"Create shirts out of the fabric and play a game where if you get ""displayed"" you are out."332,"Workers outfits that can change depending on the season or possible sales they have. A simple touch can even change it through out the day, such as if a restaurant's specials have changed and it needs to be updated."337,Put a small piece in a car where it can display directions through touch.339,Construction coverings.  The cloth covering shows what the building will look like when its finished.341,A tent could have it to produce stars inside the tent. So little kids could camp indoors and still see the stars.344,use it as a couch covering with favorite pictures346,Fashion (Change the color and or pattern of your outfit)349,Crime (chameleon like matching your scenery so you blend in)351,"Have clothes that will allow the designs to change, so someone can have a different a different look every day of the week with the same clothes."353,"Hat that changes color when you touch it for staying cool/warm (one touch light, another dark)."354,"Animated Building coverings, changing color/looks much faster then painting."357,Wearable watch on your long sleeve shirt.360,Heads up display on the brim of your hat.361,"Use it on interior of cars. That way when a salesman is showing cars to customers, they can easily show how different colors of interior would look."364,"Interchangeable Uniform (one outfit programmed for the division, FBI/SWAT etc without having to print different sets)"373,People can drape a large fabric anywhere and use it as a movie screen. That way it is very portable.376,Reusable media (download your favorite book/newspaper to it to take with you traveling).378,clothes that change color/pattern with emotion using the touch sensor379,"Decoration, Cover your living room with it and change your colors depending on your mood."383,clothes that change color depending on the weather forecast385,"Sports clothes that can change through out the year, showing your support for your team as a season progresses."387,"Teaching tool, use it to teach colors and patterns interactively to children. When they touch the right answer it changes to show they answered correctly."388,clothes that change color to make you more or less prominent in your environment depending on whether you want to stand out/blend in392,"National defense, rather then camouflaged netting, have a camera that records the surrounding area and matches the cover to the environment."396,a kids magic kit with a curtain that changes color to hide similarly colored objects/disappear399,"Prom dresses that a girl can change the design on in moments, during her special day. It's as easy as just touching it to do so."408,store text/images in fabric for spying purposes410,"Teaching tool, can be moved around and interacted with and not as large and inflexible as a chalk board.  Can project class displays and can be passed around for students to get a closer look rather then having to get up and look at it."417,Halloween costumes with safety reflectors built in.  Can be turned on and off depending on if you are outside and need them or inside and don't want the look of the costume ruined by a yellow band.419,Perfect color matching for fashion.  Take a photo of the color you want and project it on the fabric.424,diving suit that camouflages itself to better observe wildlife426,Portable energy transference.  Able to change the color of coverings for pool/hot tub/camping showers to allow them to soak up the heat from the sun's rays.  Also able to change to a non dark color to keep the same things cooler.429,changeable color/pattern fabric wallpaper432,flags/pompoms for sports games with rapidly changing team colors and logos438,curtains that darken in high sunlight hours444,car upholstery that lightens in hot weather493,Colorful bathwater for kids494,"Use fabric as t-shirts to display team name, score and a message i.e. ""Go Cowboys!"""496,Bedsheets497,Use fabric on tote bag for a shopping list/reminder.498,Clothes change colors499,Shirts that you can change the images on502,Change furniture color504,Use fabric in frames as a scrolling picture display like an electronic frame but larger and lighter.505,Clothes with customizable appearances.506,Make your own poster509,Super thin tv511,Change color of blankets512,Cheaper alternative for touch displays where high resolution isn't a priority.513,Touch screens that fold up like handkerchiefs. They could fold out into a large surface that connects to your phone.514,"Have employees wear shirts with special offers on in stores, i.e. ""Melons on special today!"""515,Use it as an interactive t shirt. Something where people can change the design of their shirt at will.516,Pocket  tv517,"Create page-like fabric for ebook display for those people who still want the feel of paper books,"518,Foldable computer519,Use as overshirts for construction workers on or near roads with flashing lights/hazard signs etc.521,Portable tv524,Displaying the fabric for cooking recipes in the kitchen.525,"Interactive tent could show you the weather, identify the stars overhead, change color to match your surroundings, or change color to reflect the temperature outside."526,Color your walls527,You could use it to make color changing draperies. It would be nice to change the color of your blinds and curtains at the touch of a button.529,Holiday decorations531,"Use large pieces of fabric to display artwork on in a nice frame, the artwork can be changed easily."532,Fabric overlay for use on building walls with customizable paint or pattern appearances to replace traditional painting or wallpapering.534,Replace a chalkboard in the classroom535,"Displayed in hotel bathrooms, etc for marking purposes."536,TVs or monitors with fabric screens would be more durable and far less easily damaged than glass screens.539,immersive game playing/video. set up a spherical cloth/tent; get inside; use tech to display environment/movie.541,"Use banner sized fabric to display advertisements either on temporary construction areas, ""Pardon our Dust"" or ""Coming soon - yet another Starbucks!"""544,"When purchasing something on line, this feature may be useful to customers if the information from the device was displayed on the info page for the item"546,Warning sign547,"A more convenient way to do maritime flag signaling, with flags that can change display while on the pole."549,"Pop up televisions or monitors, on a plastic stand, that were lightweight and easy to put away would be really nice."551,Wearable advertising552,"Clothes that have interchangeable logos, etc."553,"Use medium to large sized pieces of fabric for protestors, their message can scroll across, ""Say yes to Gun Control! 98% of Americans can't be wrong!"" etc"554,curtains that change colors/play background images like jungle scenery.556,Entertain a child559,clothes that change colors560,Advertisement562,Welcome rugs with many different styles showing at random.563,Use as message boards on bus/train/cabs either city type messages or advertising.564,You could make sports jerseys where you can change the players name at will.565,"scratch that last idea, i just realized the device ""puts"" images on the cloth. i thought it said it would ""make"" images of the cloth. sorry"567,Allows you to hang a sheet on a clothes line and create an outdoor TV screen569,"People can make clothes, or bags with detailed high quality images on them or their choice and would be better than those iron on things"570,Use as a projection screen to screen videos for a party.571,"Blankets or sheets that were also sex toys would be fun. Could change the color to ""get lucky red"" and use the screen to show positions like twister."572,Sofa sets that have can be changed to different colors to match the customers room colors.573,Create wearable advertisements where messages/brands on shirts/pants change periodically574,Create a picture album throw blanket which cycles through pictures575,"Used as wrapping fabric for presents, with programmable alternating displays."576,Use in a corporate setting to train staff via videos or power point presentations.577,modeling dynamic processes with shaped cloth and display579,Make billboards that can display in real time weather conditions.580,Create writeable work pants where the user can write reminders/things to remember on their clothes with their finger.581,fabric maps for soldiers lost in combat.582,"it would be easier for people to make designs for fabrics by creating images first, and then printing them on the fabric"583,Used as a smartphone or tablet display on shirt sleeves as part of a wearable computer package.584,I would like to have fabric wallpaper that changed colors according to the temperature and light outside. Wallpaper that would glow and brighten up the house in winter would be really nice. Even better if it could deliver our necessary vitamin d at the same time.585,Use on the floor as a dancing step instructor - i.e. sillouhettes of feet appear where yours should be.586,Portable magazines - can be used to store favorite magazines on the go.588,phone conferencing through your clothes589,"Use as a musical play mat for kids, pictures of shapes make specific sounds. Make it big enough for more than one kid. In fact make it big enough for a whole classroom of kids."590,kids trick or treating at night will be highly visible with light up custom costumes591,Exterior decorative fabrics - used to shade areas in the yard with nature displays.592,Tie in with Twister to make a spinner unneccesary - spots light up where the next body part should go.595,Decorative table napkins.  Napkins could change color/design and even respond to touch.597,"Use as a flag in hotels, displaying the flag of the nationality of the person checking in."598,Bandages that could display first aid instructions would be good. Even better would be if bandages or a cast could show ongoing diagnostics about the wound or break.599,"shirt display of running time, heart rate, blood pressure, speed etc. can be generalized to any workout"600,Display spooky images as part of a haunted halloween house.601,"Used as a display on a flat stretched cloth surface to create the image of a flag waving in the wind, independent of actual wind conditions."602,"people could be very creative and make things their own style by putting their own images on things they already own. like monograms on a shirt, or a bag, or an image of their pet on the collar of their shirt. They could make things uniqe and it wouldn't be as dificult as an iron on thing"603,Wallpaper idea again - it would be perfect if I could change the color of my walls with a touch of a button.606,Make a shirt that allows other to promote items on them at events. This would allow advertising to be done digitally and more paper would be saved.607,group gathering wearing shirts that proclaim their group name and make them customizable608,Business ad sheet display. Used to advertise business info in front of shop.609,"Use to manufacture kids play houses and change the image of the house periodically, i.e. castle, log cabin, cottage, tiki hut."610,Pop up books with fabric displays could have interactive video and images.611,the clothing industry would be able to use this device to make better quality graffic tees and such by printing what they want on their clothes and them not fading or peeling off as easily.614,Use large banner sized pieces to display weather and temperature news.615,headbands to wear in hair616,Use as a projection screen for live twitter feeds at events such as comic con.617,Use it as a fabric for beds that can be changed on demand.